{
  "$schema": "http://json-schema.org/draft-07/schema#",
  "$id": "https://trustproof.dev/spec/trustproof.schema.json",
  "title": "TrustProof Claims Envelope v1",
  "type": "object",
  "additionalProperties": false,
  "required": [
    "subject",
    "action",
    "resource",
    "policy",
    "result",
    "hashes",
    "timestamp",
    "jti",
    "chain"
  ],
  "properties": {
    "subject": {
      "type": "object",
      "additionalProperties": false,
      "required": ["type", "id"],
      "properties": {
        "type": {
          "type": "string",
          "enum": ["human", "agent"]
        },
        "id": {
          "type": "string",
          "minLength": 1
        }
      }
    },
    "action": {
      "type": "string",
      "minLength": 1
    },
    "resource": {
      "type": "object",
      "additionalProperties": false,
      "required": ["type", "id"],
      "properties": {
        "type": {
          "type": "string",
          "minLength": 1
        },
        "id": {
          "type": "string",
          "minLength": 1
        }
      }
    },
    "policy": {
      "type": "object",
      "additionalProperties": false,
      "required": ["policy_v", "scopes", "constraints"],
      "properties": {
        "policy_v": {
          "const": "v0"
        },
        "scopes": {
          "type": "array",
          "items": {
            "type": "string",
            "minLength": 1
          }
        },
        "constraints": {
          "type": "object",
          "additionalProperties": false,
          "properties": {
            "max_amount_cents": {
              "type": "integer",
              "minimum": 0
            },
            "currency_allowlist": {
              "type": "array",
              "items": {
                "type": "string",
                "minLength": 1
              }
            },
            "merchant_allowlist": {
              "type": "array",
              "items": {
                "type": "string",
                "minLength": 1
              }
            }
          }
        }
      }
    },
    "result": {
      "type": "object",
      "additionalProperties": false,
      "required": ["decision", "reason_codes"],
      "properties": {
        "decision": {
          "type": "string",
          "enum": ["allow", "deny", "step_up"]
        },
        "reason_codes": {
          "type": "array",
          "items": {
            "type": "string",
            "minLength": 1
          }
        }
      }
    },
    "hashes": {
      "type": "object",
      "additionalProperties": false,
      "required": ["input_hash", "output_hash"],
      "properties": {
        "input_hash": {
          "type": "string",
          "pattern": "^[a-fA-F0-9]{64}$"
        },
        "output_hash": {
          "type": "string",
          "pattern": "^[a-fA-F0-9]{64}$"
        }
      }
    },
    "timestamp": {
      "type": "string",
      "pattern": "^\\d{4}-\\d{2}-\\d{2}T\\d{2}:\\d{2}:\\d{2}(?:\\.\\d+)?Z$"
    },
    "jti": {
      "type": "string",
      "minLength": 1
    },
    "chain": {
      "type": "object",
      "additionalProperties": false,
      "required": ["prev_hash", "entry_hash"],
      "properties": {
        "prev_hash": {
          "type": "string",
          "anyOf": [
            {
              "const": "0000000000000000000000000000000000000000000000000000000000000000"
            },
            {
              "pattern": "^[a-fA-F0-9]{64}$"
            }
          ]
        },
        "entry_hash": {
          "type": "string",
          "pattern": "^[a-fA-F0-9]{64}$"
        }
      }
    }
  }
}
